{
  "artifact_sha256": "d2d765c4b93ded09e8505d60da32d9f49aea7f6fa3e4edf6e0bd1e499f7a824a",
  "claim_boundary": "本计划仅比较已完成活动周 24 和进行中活动周 25 的峰值时间统计差异。不推断活动周 26 的趋势或强度，不声称太阳发电机因果证明，不把 NOAA/SWPC 产品改称活动周 26 预报。活动周 25 尚未完成，峰值时间可能因后续数据修订而变化。13 个月居中平滑值在未来半窗到达前不可用于实时起点。Waldmeier 关系仅提供形态学约束，不能证明发电机起源。",
  "counter_evidence_paths": [
    "E7_negative_controls_and_placebos",
    "E2_waldmeier_leave_one_cycle_out"
  ],
  "created_at": "2026-07-14T17:58:37.354371+00:00",
  "data_contracts": [
    {
      "available_at": "2026-06-21T06:14:00Z",
      "data_status": "definitive",
      "id": "silso_monthly_total",
      "license": "CC-BY-NC-4.0",
      "semantic_layer": "observation",
      "sha256": "de910b1bf7c52663cf4ee1a73772a3c76ccea339d7f97170e779465a0be10584",
      "source": "SILSO monthly sunspot number V2.0",
      "time_coverage": "1749-present",
      "version": "2.0"
    },
    {
      "available_at": "2026-06-21T06:14:02Z",
      "data_status": "definitive",
      "id": "silso_monthly_smoothed_total",
      "license": "CC-BY-NC-4.0",
      "semantic_layer": "observation",
      "sha256": "0848ca0fd38da6fdc985f253b5e1ebe6fb1fe41ec4879ea45572c107e4ef5ab2",
      "source": "SILSO smoothed sunspot number V2.0",
      "time_coverage": "1749-present",
      "version": "2.0"
    },
    {
      "available_at": "2026-06-21T06:14:07Z",
      "data_status": "provisional",
      "id": "noaa_observed_solar_cycle_indices",
      "license": "U.S.-Government-work",
      "semantic_layer": "observation",
      "sha256": "2adb1094a5364d0aeb0027cd239399625d4a6762f19b8999f38831972cb4709c",
      "source": "NOAA observed solar cycle indices",
      "time_coverage": "1749-present",
      "version": "live"
    },
    {
      "available_at": "2026-06-21T06:14:08Z",
      "data_status": "provisional",
      "id": "noaa_predicted_solar_cycle",
      "license": "U.S.-Government-work",
      "semantic_layer": "proxy",
      "sha256": "34c389b39e9a87398dc68f4466333801d3ee1aedc6eb49261f91845f82120e0c",
      "source": "NOAA predicted solar cycle",
      "time_coverage": "cycle24-25",
      "version": "live"
    },
    {
      "available_at": "2026-06-21T06:14:04Z",
      "data_status": "definitive",
      "id": "silso_monthly_hemispheric",
      "license": "CC-BY-NC-4.0",
      "semantic_layer": "observation",
      "sha256": "473c89313c482f3d87a9bfdee8f768f181417ed37df0fcd9db944618e4855b63",
      "source": "SILSO hemispheric sunspot number V2.0",
      "time_coverage": "1992-present",
      "version": "2.0"
    },
    {
      "available_at": "2026-07-13T10:37:04Z",
      "data_status": "retrospective",
      "id": "silso_extended_hemispheric_catalogue_b",
      "license": "CC-BY-NC-4.0",
      "semantic_layer": "reconstruction",
      "sha256": "a2398fb2d85be30088e0bc4813e2b58a118ab62a27fda567cc8272408b488419",
      "source": "SILSO extended hemispheric catalogue B (Veronig+2021)",
      "time_coverage": "1874-2020",
      "version": "reviewed"
    },
    {
      "available_at": "2026-06-21T06:14:10Z",
      "data_status": "provisional",
      "id": "wso_polar_field_observations",
      "license": "not-explicitly-specified-by-source",
      "semantic_layer": "observation",
      "sha256": "1bd718e75d4832419164491f0a28296ba86017b4acf3d8d36e17811ed7e14113",
      "source": "WSO polar field observations",
      "time_coverage": "1976-present",
      "version": "live"
    }
  ],
  "frozen_hash": "35a3e0b9492896422410db67e23aa251a288cd53c8d2784ae107cdd03bf7006e",
  "primary_metrics": [
    "活动周 24 峰值时间（居中 13 个月平滑最大值对应月份）",
    "活动周 25 当前峰值时间（同上方法）",
    "峰值时间差异（月数）",
    "差异的统计显著性（bootstrap 置信区间或参数检验 p 值）",
    "数据版本审计通过率",
    "负对照通过率"
  ],
  "research_question": "Is the peak timing of solar cycle 25 statistically significantly different from cycle 24",
  "run_id": "Is_the_peak_timing_of_solar_cycle_25_statistically_significantly_different_from_cycle_24_20260714T175836Z_811c60c2",
  "schema_version": "b3-research-plan-v2",
  "status": "frozen",
  "stop_rules": [
    "E0 数据版本审计失败则停止全部下游",
    "E1 周期分割无法识别活动周 24 或 25 峰值则停止",
    "泄漏检测触发则 quarantine 相关节点",
    "墙钟预算耗尽则停止",
    "E7 负对照失败则峰值时间差异的阳性主张降级"
  ],
  "task_graph": [
    {
      "budget": {
        "wall_seconds": 60
      },
      "depends_on": [],
      "failure_strategy": "阻断所有下游节点",
      "id": "N0",
      "inputs": [
        "silso_monthly_total",
        "silso_monthly_smoothed_total",
        "silso_monthly_hemispheric",
        "silso_extended_hemispheric_catalogue_b",
        "noaa_observed_solar_cycle_indices",
        "noaa_predicted_solar_cycle",
        "wso_polar_field_observations"
      ],
      "outputs": [
        "artifacts/E0_data_vintage_audit.json"
      ],
      "seed": 0,
      "split_strategy": "not_applicable",
      "status": "ready",
      "success_criteria": [
        "所有数据快照 SHA-256、字节数、许可和时间覆盖与 source_manifest 一致"
      ],
      "tool": "registered:E0_data_vintage_audit",
      "type": "data_audit"
    },
    {
      "budget": {
        "wall_seconds": 120
      },
      "depends_on": [
        "N0"
      ],
      "failure_strategy": "降级为描述性基线，无法进行峰值时间统计比较",
      "id": "N1",
      "inputs": [
        "silso_monthly_total",
        "silso_monthly_smoothed_total"
      ],
      "outputs": [
        "artifacts/E1_cycle_segmentation.json"
      ],
      "seed": 42,
      "split_strategy": "expanding_window",
      "status": "ready",
      "success_criteria": [
        "完成活动周 24 与 25 的周期分割并提取峰值时间，标记 13 个月平滑在未来半窗不可用"
      ],
      "tool": "registered:E1_cycle_segmentation_baseline",
      "type": "baseline"
    },
    {
      "budget": {
        "wall_seconds": 120
      },
      "depends_on": [
        "N1"
      ],
      "failure_strategy": "标记形态学约束为不确定",
      "id": "N2",
      "inputs": [
        "silso_monthly_total"
      ],
      "outputs": [
        "artifacts/E2_waldmeier.json"
      ],
      "seed": 42,
      "split_strategy": "leave_one_cycle_out",
      "status": "ready",
      "success_criteria": [
        "Waldmeier 上升时间-峰值关系在留一验证下符号和效应稳定，包含活动周 24 和 25"
      ],
      "tool": "registered:E2_waldmeier_leave_one_cycle_out",
      "type": "experiment"
    },
    {
      "budget": {
        "wall_seconds": 120
      },
      "depends_on": [
        "N1"
      ],
      "failure_strategy": "代理量约束降级",
      "id": "N3",
      "inputs": [
        "noaa_observed_solar_cycle_indices"
      ],
      "outputs": [
        "artifacts/E3_f107_drift.json"
      ],
      "seed": 42,
      "split_strategy": "expanding_window",
      "status": "ready",
      "success_criteria": [
        "F10.7-黑子关系在活动周 24 和 25 的峰值相位漂移检测完成"
      ],
      "tool": "registered:E3_f107_phase_stratified_drift",
      "type": "experiment"
    },
    {
      "budget": {
        "wall_seconds": 120
      },
      "depends_on": [
        "N0"
      ],
      "failure_strategy": "If overlap calibration RMSE exceeds 2-sigma uncertainty or overlap period is fewer than 24 months the node is marked inconclusive and hemispheric evidence is downgraded",
      "id": "N4",
      "inputs": [
        "silso_extended_hemispheric_catalogue_b",
        "silso_monthly_hemispheric"
      ],
      "outputs": [
        "artifacts/E4_hemispheric.json"
      ],
      "seed": 42,
      "split_strategy": "expanding_window",
      "status": "ready",
      "success_criteria": [
        "Pre-1992 reconstruction is calibrated only on the declared overlap with post-1992 direct observation; if registered overlap RMSE exceeds 2-sigma uncertainty tolerance the node is inconclusive"
      ],
      "tool": "registered:E4_extended_hemispheric_calibration",
      "type": "experiment"
    },
    {
      "budget": {
        "wall_seconds": 120
      },
      "depends_on": [
        "N0"
      ],
      "failure_strategy": "前兆约束降级为 insufficient_evidence",
      "id": "N5",
      "inputs": [
        "wso_polar_field_observations"
      ],
      "outputs": [
        "artifacts/E5_polar_precursor.json"
      ],
      "seed": 42,
      "split_strategy": "leave_one_cycle_out",
      "status": "ready",
      "success_criteria": [
        "极区场-下一周峰值关系通过留一和符号敏感性检验"
      ],
      "tool": "registered:E5_polar_precursor_robustness",
      "type": "experiment"
    },
    {
      "budget": {
        "wall_seconds": 180
      },
      "depends_on": [
        "N1",
        "N5"
      ],
      "failure_strategy": "机制合理性标记为 diagnostic_only",
      "id": "N6",
      "inputs": [
        "silso_monthly_total",
        "wso_polar_field_observations"
      ],
      "outputs": [
        "artifacts/E6_dynamo_ablation.json"
      ],
      "seed": 42,
      "split_strategy": "expanding_window",
      "status": "ready",
      "success_criteria": [
        "Babcock-Leighton 闭合、线性前兆、持续性与中位数基线的峰值时间预测比较完成"
      ],
      "tool": "registered:E6_low_order_dynamo_family_ablation",
      "type": "ablation"
    },
    {
      "budget": {
        "wall_seconds": 120
      },
      "depends_on": [
        "N2",
        "N3",
        "N5"
      ],
      "failure_strategy": "所有峰值时间差异的阳性主张置信度降级",
      "id": "N7",
      "inputs": [
        "silso_monthly_total",
        "noaa_observed_solar_cycle_indices",
        "wso_polar_field_observations"
      ],
      "outputs": [
        "artifacts/E7_negative_controls.json"
      ],
      "seed": 42,
      "split_strategy": "not_applicable",
      "status": "ready",
      "success_criteria": [
        "时间打乱和相位安慰剂不产生虚假的峰值时间差异结构"
      ],
      "tool": "registered:E7_negative_controls_and_placebos",
      "type": "negative_control"
    },
    {
      "budget": {
        "wall_seconds": 300
      },
      "depends_on": [
        "N0",
        "N1",
        "N2",
        "N3",
        "N4",
        "N5",
        "N6",
        "N7"
      ],
      "failure_strategy": "复现失败阻断最终报告",
      "id": "N8",
      "inputs": [
        "artifacts/E0_data_vintage_audit.json",
        "artifacts/E1_cycle_segmentation.json",
        "artifacts/E2_waldmeier.json",
        "artifacts/E3_f107_drift.json",
        "artifacts/E4_hemispheric.json",